[{"id":0,"name":"Pablo Sanchez","email":"psanchez@false.com","birthDate":"01/01/1999","address":{"id":0,"street":"Cll 10 Cra 9 - 8","state":"AnotherFakeState","city":"AnotherFakeCity","country":"AnotherFakeCountry","zip":"ZiiiiiUp"}},{"id":0,"name":"string","email":"string","birthDate":"string","address":{"id":0,"street":"string","state":"string","city":"string","country":"string","zip":"string"}}]